{
  "corpus_parent": "새 폴더 (2)",
  "documents": [
    {
      "blocked_on": "CARRIER_INQUIRY",
      "currentness": "CURRENTNESS_UNVERIFIED",
      "path": "새 폴더 (2)/KT/20260702-EN/KT 5G NSA Features SAT Specification_V1.3.0_En.pdf",
      "recorded_date": "2026-08-14",
      "root": "새 폴더 (2)/KT",
      "sha256": "a00feaf4b720ba79cc9e65e4e0fedea64bb0a85db07460d82d1de300d1ef7858",
      "size_bytes": 1719683,
      "state": "PENDING_REVIEW"
    },
    {
      "blocked_on": "CARRIER_INQUIRY",
      "currentness": "CURRENTNESS_UNVERIFIED",
      "path": "새 폴더 (2)/KT/20260702-EN/KT 5G SA Disaster Alert Services SAT Specfication_(V1.0.1)_210405_En.pdf",
      "recorded_date": "2026-08-14",
      "root": "새 폴더 (2)/KT",
      "sha256": "13dae3299fea87e8e9c5be1ec08944fc909605b27dda2d71aac9306c6ed543ad",
      "size_bytes": 435101,
      "state": "PENDING_REVIEW"
    },
    {
      "blocked_on": "CARRIER_INQUIRY",
      "currentness": "CURRENTNESS_UNVERIFIED",
      "path": "새 폴더 (2)/KT/20260702-EN/KT 5G SA Emergency Alert Service SAT Specification_(V1.0.1)_210405_En.pdf",
      "recorded_date": "2026-08-14",
      "root": "새 폴더 (2)/KT",
      "sha256": "baa58a10c0f4d56684ddf4697f7047d4f7b0771dc095bc480c3fd511c6876969",
      "size_bytes": 435101,
      "state": "PENDING_REVIEW"
    },
    {
      "blocked_on": "CARRIER_INQUIRY",
      "currentness": "CURRENTNESS_UNVERIFIED",
      "path": "새 폴더 (2)/KT/20260702-EN/KT 5G SA Terminal Function SAT Specifications V1_v1.6.0.pdf",
      "recorded_date": "2026-08-14",
      "root": "새 폴더 (2)/KT",
      "sha256": "a2dec3d683f9f00cdcbd4ac88cd3adb3def2555e6d9132ed14f1782e0d5a742d",
      "size_bytes": 1780670,
      "state": "PENDING_REVIEW"
    },
    {
      "blocked_on": "CARRIER_INQUIRY",
      "currentness": "CURRENTNESS_UNVERIFIED",
      "path": "새 폴더 (2)/KT/20260702-EN/KT LTE Technical Requirement_v.3.8.0_en.pdf",
      "recorded_date": "2026-08-14",
      "root": "새 폴더 (2)/KT",
      "sha256": "53d4ceec89155269f000e104a091996a800e5b4b04ae34d6f7633ea5bcb816fb",
      "size_bytes": 4341718,
      "state": "PENDING_REVIEW"
    },
    {
      "blocked_on": "CARRIER_INQUIRY",
      "currentness": "CURRENTNESS_UNVERIFIED",
      "path": "새 폴더 (2)/KT/20260702-EN/KT VoNR Terminal SAT Specification_v1.0.1.pdf",
      "recorded_date": "2026-08-14",
      "root": "새 폴더 (2)/KT",
      "sha256": "4b733ddbcba3978be51a4c0ce004b8cf0e7670f3b1f9afa516d05633ee2624ab",
      "size_bytes": 859912,
      "state": "PENDING_REVIEW"
    },
    {
      "blocked_on": "INTERNAL_DECISION",
      "currentness": "CURRENTNESS_UNVERIFIED",
      "path": "새 폴더 (2)/KT/20260702-EN/[KISA-001] Easy Spam Report Service Requirement_V4.0_En.pdf",
      "recorded_date": "2026-08-14",
      "root": "새 폴더 (2)/KT",
      "sha256": "b61e77e3fe41913d1f2e4bdc58bcb5b10118e429de8308b71e711e132f909063",
      "size_bytes": 1235482,
      "state": "PENDING_REVIEW"
    },
    {
      "blocked_on": "CARRIER_INQUIRY",
      "currentness": "CURRENTNESS_UNVERIFIED",
      "path": "새 폴더 (2)/KT/20260702-EN/[KT-CALL-001] KT IMS Device Requirement_v3.0.4_En.pdf",
      "recorded_date": "2026-08-14",
      "root": "새 폴더 (2)/KT",
      "sha256": "e0c2044a1d0d8a8c5e621ad908f7f40d737daaf1cce8d0a3473e319ed6cf3741",
      "size_bytes": 2303026,
      "state": "PENDING_REVIEW"
    },
    {
      "blocked_on": "CARRIER_INQUIRY",
      "currentness": "CURRENTNESS_UNVERIFIED",
      "path": "새 폴더 (2)/KT/20260702-EN/[KT-CALL-001] KT IMS Device Specification V3.5.0.pdf",
      "recorded_date": "2026-08-14",
      "root": "새 폴더 (2)/KT",
      "sha256": "612e812cef8b69a1260b41ca4d67cfa3b5b411f17ff63c2d026641b34dfbf014",
      "size_bytes": 2090495,
      "state": "PENDING_REVIEW"
    },
    {
      "blocked_on": "CARRIER_INQUIRY",
      "currentness": "CURRENTNESS_UNVERIFIED",
      "path": "새 폴더 (2)/KT/20260702-EN/[KT-CALL-002] KT VoLTE Device Requirement_v3.5.0_En.pdf",
      "recorded_date": "2026-08-14",
      "root": "새 폴더 (2)/KT",
      "sha256": "b4eba30c7c1ddf1e13240a98647550ea42f6d39e2328aa8b6a9bd2bf7a1dd5cb",
      "size_bytes": 1368413,
      "state": "PENDING_REVIEW"
    },
    {
      "blocked_on": "CARRIER_INQUIRY",
      "currentness": "CURRENTNESS_UNVERIFIED",
      "path": "새 폴더 (2)/KT/20260702-EN/[KT-CALL-003] HD Voice UI Requirements_V1.2.4_En.pdf",
      "recorded_date": "2026-08-14",
      "root": "새 폴더 (2)/KT",
      "sha256": "e0997b41f780a9047187855718f2d024b3beed4f3a1d2d18f9504e4af7eed392",
      "size_bytes": 1120611,
      "state": "PENDING_REVIEW"
    },
    {
      "blocked_on": "CARRIER_INQUIRY",
      "currentness": "CURRENTNESS_UNVERIFIED",
      "path": "새 폴더 (2)/KT/20260702-EN/[KT-CALL-004] KT VoNR Terminal Specification_V1.1.0_En.pdf",
      "recorded_date": "2026-08-14",
      "root": "새 폴더 (2)/KT",
      "sha256": "c413f09a2113bc2ad18b6ae218519a1d7f2960c7cfb313777c4b18f941f01e58",
      "size_bytes": 837443,
      "state": "PENDING_REVIEW"
    },
    {
      "blocked_on": "CARRIER_INQUIRY",
      "currentness": "CURRENTNESS_UNVERIFIED",
      "path": "새 폴더 (2)/KT/20260702-EN/[KT-CBS-001] LTE CBS Function Requirements_V1.1.0.pdf",
      "recorded_date": "2026-08-14",
      "root": "새 폴더 (2)/KT",
      "sha256": "d8ef5dab1dcca7584a8e9866daba66182c89a440962013232d7a83e3d2d9e462",
      "size_bytes": 316839,
      "state": "PENDING_REVIEW"
    },
    {
      "blocked_on": "CARRIER_INQUIRY",
      "currentness": "CURRENTNESS_UNVERIFIED",
      "path": "새 폴더 (2)/KT/20260702-EN/[KT-CBS-002] KPAS Service Requirements_V1.1.2_En.pdf",
      "recorded_date": "2026-08-14",
      "root": "새 폴더 (2)/KT",
      "sha256": "d2690ea1082cede7cd3ee05608d04849015ec7218a3eadab50044f53e0357ab9",
      "size_bytes": 282454,
      "state": "PENDING_REVIEW"
    },
    {
      "blocked_on": "CARRIER_INQUIRY",
      "currentness": "CURRENTNESS_UNVERIFIED",
      "path": "새 폴더 (2)/KT/20260702-EN/[KT-CBS-003] KT 5G SA CBS Fetures Specification_V1.0.0-201125_En.pdf",
      "recorded_date": "2026-08-14",
      "root": "새 폴더 (2)/KT",
      "sha256": "a68585060777bf3e0a9993ec597d617adb33419439dae5a3ba84c2d7c1174f12",
      "size_bytes": 272482,
      "state": "PENDING_REVIEW"
    },
    {
      "blocked_on": "CARRIER_INQUIRY",
      "currentness": "CURRENTNESS_UNVERIFIED",
      "path": "새 폴더 (2)/KT/20260702-EN/[KT-CBS-004] KT 5G SA Disaster Alert Services Specification_V1.0.1_210405_En.pdf",
      "recorded_date": "2026-08-14",
      "root": "새 폴더 (2)/KT",
      "sha256": "a8579374547e1bde345e2d47245bb4166ee4025103d5cbeb32aec5a1ff2dd489",
      "size_bytes": 362404,
      "state": "PENDING_REVIEW"
    },
    {
      "blocked_on": "CARRIER_INQUIRY",
      "currentness": "CURRENTNESS_UNVERIFIED",
      "path": "새 폴더 (2)/KT/20260702-EN/[KT-DEV-001] Device UI Requirements_V1.3.8_En.pdf",
      "recorded_date": "2026-08-14",
      "root": "새 폴더 (2)/KT",
      "sha256": "fa2a5503d80c24a5b656168c26bdef848d0b135110bb43019732ff22cbd5b858",
      "size_bytes": 1370186,
      "state": "PENDING_REVIEW"
    },
    {
      "blocked_on": "CARRIER_INQUIRY",
      "currentness": "CURRENTNESS_UNVERIFIED",
      "path": "새 폴더 (2)/KT/20260702-EN/[KT-DEV-002] KT Indicator Display Guide_230315_En.pdf",
      "recorded_date": "2026-08-14",
      "root": "새 폴더 (2)/KT",
      "sha256": "5552ac51e8da9cbbd9895798f8e4c85620fd9e7794c6b12a55475fcf4bb80ebd",
      "size_bytes": 92703,
      "state": "PENDING_REVIEW"
    },
    {
      "blocked_on": "CARRIER_INQUIRY",
      "currentness": "CURRENTNESS_UNVERIFIED",
      "path": "새 폴더 (2)/KT/20260702-EN/[KT-DEV-003] WCDMA & LTE Android Device Extension Porting Guide_V1.1.5_En.pdf",
      "recorded_date": "2026-08-14",
      "root": "새 폴더 (2)/KT",
      "sha256": "cd9d4f0d25166c3b0c2d10fc97509e810467f54dfa2581daa59fbc0eb5d48f33",
      "size_bytes": 700342,
      "state": "PENDING_REVIEW"
    },
    {
      "blocked_on": "CARRIER_INQUIRY",
      "currentness": "CURRENTNESS_UNVERIFIED",
      "path": "새 폴더 (2)/KT/20260702-EN/[KT-MSG-001] KT Wireless SMS Device Requirement V3.5.0_En.pdf",
      "recorded_date": "2026-08-14",
      "root": "새 폴더 (2)/KT",
      "sha256": "8a905f6156135cb97fdc8bc24612ff84568c40321d98386793f61ced8a48684d",
      "size_bytes": 1263420,
      "state": "PENDING_REVIEW"
    },
    {
      "blocked_on": "CARRIER_INQUIRY",
      "currentness": "CURRENTNESS_UNVERIFIED",
      "path": "새 폴더 (2)/KT/20260702-EN/[KT-MSG-002] OMA MMA Function Requirements_V1.2.1_En.pdf",
      "recorded_date": "2026-08-14",
      "root": "새 폴더 (2)/KT",
      "sha256": "b06c9756f6cdbe4bef9ada6591f58641a0d649afd29a39481afabd8b5d0e7671",
      "size_bytes": 1120846,
      "state": "PENDING_REVIEW"
    },
    {
      "blocked_on": "CARRIER_INQUIRY",
      "currentness": "CURRENTNESS_UNVERIFIED",
      "path": "새 폴더 (2)/KT/20260702-EN/[KT-MSG-003] KT Message Integrated Device UI Requirements_V1.2.2_En.pdf",
      "recorded_date": "2026-08-14",
      "root": "새 폴더 (2)/KT",
      "sha256": "eb134c326bc8bdb8eaa0769b9fde5c92efefa2a3037b4716697b27ef173d7b92",
      "size_bytes": 2156575,
      "state": "PENDING_REVIEW"
    },
    {
      "blocked_on": "CARRIER_INQUIRY",
      "currentness": "CURRENTNESS_UNVERIFIED",
      "path": "새 폴더 (2)/KT/20260702-EN/[KT-MSG-004] KT SPAM Message Handling Requirements_V1.5.0_En.pdf",
      "recorded_date": "2026-08-14",
      "root": "새 폴더 (2)/KT",
      "sha256": "33a94682b94c9aa6f6acd17d9ca566539376515fa93a52fc6a93af7668af2d86",
      "size_bytes": 390153,
      "state": "PENDING_REVIEW"
    },
    {
      "blocked_on": "CARRIER_INQUIRY",
      "currentness": "CURRENTNESS_UNVERIFIED",
      "path": "새 폴더 (2)/KT/20260702-EN/[KT-MSG-005] Spam Easy Report Service Requirements_V2.1.0_En.pdf",
      "recorded_date": "2026-08-14",
      "root": "새 폴더 (2)/KT",
      "sha256": "1a2bcef363381f4e1183f658ffcc97f2c7f21c0cbb8f44fe16d02250cc0d86b0",
      "size_bytes": 202972,
      "state": "PENDING_REVIEW"
    },
    {
      "blocked_on": "CARRIER_INQUIRY",
      "currentness": "CURRENTNESS_UNVERIFIED",